{
  "schema_version": "1.0",
  "kind": "ClusterSecretStore",
  "group": "external-secrets.io",
  "version": "v1beta1",
  "plural": "clustersecretstores",
  "scope": "cluster",
  "service": "external-secrets",
  "description": "ClusterSecretStore represents a secure external location for storing secrets, which can be referenced as part of `storeRef` fields.",
  "input_refs": [],
  "output_declarations": [],
  "config_fields": [
    {
      "field": "spec.conditions",
      "type": "array",
      "description": "Used to constraint a ClusterSecretStore to specific namespaces. Relevant only to ClusterSecretStore"
    },
    {
      "field": "spec.controller",
      "type": "string",
      "description": "Used to select the correct ESO controller (think: ingress.ingressClassName)\nThe ESO controller is instantiated with a specific controller name and filters ES based on this property"
    },
    {
      "field": "spec.provider",
      "type": "object",
      "description": "Used to configure the provider. Only one provider may be set"
    },
    {
      "field": "spec.refreshInterval",
      "type": "integer",
      "description": "Used to configure store refresh interval in seconds. Empty or 0 will default to the controller config."
    },
    {
      "field": "spec.retrySettings",
      "type": "object",
      "description": "Used to configure http retries if failed"
    }
  ],
  "status_conditions": [
    "Ready"
  ],
  "execution": {
    "method": "kubectl_apply",
    "wait_condition": "condition=Ready"
  }
}
