{
  "schema_version": "1.0",
  "kind": "Middleware",
  "group": "traefik.io",
  "version": "v1alpha1",
  "plural": "middlewares",
  "scope": "namespaced",
  "service": "traefik",
  "description": "Middleware is the CRD implementation of a Traefik Middleware.\nMore info: https://doc.traefik.io/traefik/v3.6/reference/routing-configuration/http/middlewares/overview/",
  "input_refs": [],
  "output_declarations": [],
  "config_fields": [
    {
      "field": "spec.addPrefix",
      "type": "object",
      "description": "AddPrefix holds the add prefix middleware configuration.\nThis middleware updates the path of a request before forwarding it.\nMore info: https://doc.traefik.io/traefik/v3.6/middlewares/http/addprefix/"
    },
    {
      "field": "spec.basicAuth",
      "type": "object",
      "description": "BasicAuth holds the basic auth middleware configuration.\nThis middleware restricts access to your services to known users.\nMore info: https://doc.traefik.io/traefik/v3.6/reference/routing-configuration/http/middlewares/basicauth/"
    },
    {
      "field": "spec.buffering",
      "type": "object",
      "description": "Buffering holds the buffering middleware configuration.\nThis middleware retries or limits the size of requests that can be forwarded to backends.\nMore info: https://doc.traefik.io/traefik/v3.6/middlewares/http/buffering/#maxrequestbodybytes"
    },
    {
      "field": "spec.chain",
      "type": "object",
      "description": "Chain holds the configuration of the chain middleware.\nThis middleware enables to define reusable combinations of other pieces of middleware.\nMore info: https://doc.traefik.io/traefik/v3.6/reference/routing-configuration/http/middlewares/chain/"
    },
    {
      "field": "spec.circuitBreaker",
      "type": "object",
      "description": "CircuitBreaker holds the circuit breaker configuration."
    },
    {
      "field": "spec.compress",
      "type": "object",
      "description": "Compress holds the compress middleware configuration.\nThis middleware compresses responses before sending them to the client, using gzip, brotli, or zstd compression.\nMore info: https://doc.traefik.io/traefik/v3.6/reference/routing-configuration/http/middlewares/compress/"
    },
    {
      "field": "spec.contentType",
      "type": "object",
      "description": "ContentType holds the content-type middleware configuration.\nThis middleware exists to enable the correct behavior until at least the default one can be changed in a future version."
    },
    {
      "field": "spec.digestAuth",
      "type": "object",
      "description": "DigestAuth holds the digest auth middleware configuration.\nThis middleware restricts access to your services to known users.\nMore info: https://doc.traefik.io/traefik/v3.6/reference/routing-configuration/http/middlewares/digestauth/"
    },
    {
      "field": "spec.errors",
      "type": "object",
      "description": "ErrorPage holds the custom error middleware configuration.\nThis middleware returns a custom page in lieu of the default, according to configured ranges of HTTP Status codes.\nMore info: https://doc.traefik.io/traefik/v3.6/reference/routing-configuration/http/middlewares/errorpages/"
    },
    {
      "field": "spec.forwardAuth",
      "type": "object",
      "description": "ForwardAuth holds the forward auth middleware configuration.\nThis middleware delegates the request authentication to a Service.\nMore info: https://doc.traefik.io/traefik/v3.6/reference/routing-configuration/http/middlewares/forwardauth/"
    },
    {
      "field": "spec.grpcWeb",
      "type": "object",
      "description": "GrpcWeb holds the gRPC web middleware configuration.\nThis middleware converts a gRPC web request to an HTTP/2 gRPC request."
    },
    {
      "field": "spec.headers",
      "type": "object",
      "description": "Headers holds the headers middleware configuration.\nThis middleware manages the requests and responses headers.\nMore info: https://doc.traefik.io/traefik/v3.6/middlewares/http/headers/#customrequestheaders"
    },
    {
      "field": "spec.inFlightReq",
      "type": "object",
      "description": "InFlightReq holds the in-flight request middleware configuration.\nThis middleware limits the number of requests being processed and served concurrently.\nMore info: https://doc.traefik.io/traefik/v3.6/middlewares/http/inflightreq/"
    },
    {
      "field": "spec.ipAllowList",
      "type": "object",
      "description": "IPAllowList holds the IP allowlist middleware configuration.\nThis middleware limits allowed requests based on the client IP.\nMore info: https://doc.traefik.io/traefik/v3.6/middlewares/http/ipallowlist/"
    },
    {
      "field": "spec.ipWhiteList",
      "type": "object",
      "description": "Deprecated: please use IPAllowList instead."
    },
    {
      "field": "spec.passTLSClientCert",
      "type": "object",
      "description": "PassTLSClientCert holds the pass TLS client cert middleware configuration.\nThis middleware adds the selected data from the passed client TLS certificate to a header.\nMore info: https://doc.traefik.io/traefik/v3.6/middlewares/http/passtlsclientcert/"
    },
    {
      "field": "spec.plugin",
      "type": "object",
      "description": "Plugin defines the middleware plugin configuration.\nMore info: https://doc.traefik.io/traefik/v3.6/reference/routing-configuration/http/middlewares/overview/#community-middlewares"
    },
    {
      "field": "spec.rateLimit",
      "type": "object",
      "description": "RateLimit holds the rate limit configuration.\nThis middleware ensures that services will receive a fair amount of requests, and allows one to define what fair is.\nMore info: https://doc.traefik.io/traefik/v3.6/reference/routing-configuration/http/middlewares/ratelimit/"
    },
    {
      "field": "spec.redirectRegex",
      "type": "object",
      "description": "RedirectRegex holds the redirect regex middleware configuration.\nThis middleware redirects a request using regex matching and replacement.\nMore info: https://doc.traefik.io/traefik/v3.6/middlewares/http/redirectregex/#regex"
    },
    {
      "field": "spec.redirectScheme",
      "type": "object",
      "description": "RedirectScheme holds the redirect scheme middleware configuration.\nThis middleware redirects requests from a scheme/port to another.\nMore info: https://doc.traefik.io/traefik/v3.6/middlewares/http/redirectscheme/"
    },
    {
      "field": "spec.replacePath",
      "type": "object",
      "description": "ReplacePath holds the replace path middleware configuration.\nThis middleware replaces the path of the request URL and store the original path in an X-Replaced-Path header.\nMore info: https://doc.traefik.io/traefik/v3.6/middlewares/http/replacepath/"
    },
    {
      "field": "spec.replacePathRegex",
      "type": "object",
      "description": "ReplacePathRegex holds the replace path regex middleware configuration.\nThis middleware replaces the path of a URL using regex matching and replacement.\nMore info: https://doc.traefik.io/traefik/v3.6/middlewares/http/replacepathregex/"
    },
    {
      "field": "spec.retry",
      "type": "object",
      "description": "Retry holds the retry middleware configuration.\nThis middleware reissues requests a given number of times to a backend server if that server does not reply.\nAs soon as the server answers, the middleware stops retrying, regardless of the response status.\nMore info: https://doc.traefik.io/traefik/v3.6/reference/routing-configuration/http/middlewares/retry/"
    },
    {
      "field": "spec.stripPrefix",
      "type": "object",
      "description": "StripPrefix holds the strip prefix middleware configuration.\nThis middleware removes the specified prefixes from the URL path.\nMore info: https://doc.traefik.io/traefik/v3.6/middlewares/http/stripprefix/"
    },
    {
      "field": "spec.stripPrefixRegex",
      "type": "object",
      "description": "StripPrefixRegex holds the strip prefix regex middleware configuration.\nThis middleware removes the matching prefixes from the URL path.\nMore info: https://doc.traefik.io/traefik/v3.6/middlewares/http/stripprefixregex/"
    }
  ],
  "status_conditions": [
    "Ready"
  ],
  "execution": {
    "method": "kubectl_apply",
    "wait_condition": "condition=Ready"
  }
}
