{
  "schema_version": "1.0",
  "kind": "ExternalSecret",
  "group": "external-secrets.io",
  "version": "v1beta1",
  "plural": "externalsecrets",
  "scope": "namespaced",
  "service": "external-secrets",
  "description": "ExternalSecret is the schema for the external-secrets API.",
  "input_refs": [
    {
      "field": "spec.secretStoreRef",
      "target_kind": "SecretStore",
      "target_group": "external-secrets.io",
      "role": "input_ref",
      "required": false,
      "cross_namespace": false,
      "fact_ref": "crdfacts://external-secrets.io/SecretStore#secretStoreRef"
    }
  ],
  "output_declarations": [],
  "config_fields": [
    {
      "field": "spec.data",
      "type": "array",
      "description": "Data defines the connection between the Kubernetes Secret keys and the Provider data"
    },
    {
      "field": "spec.dataFrom",
      "type": "array",
      "description": "DataFrom is used to fetch all properties from a specific Provider data\nIf multiple entries are specified, the Secret keys are merged in the specified order"
    },
    {
      "field": "spec.refreshInterval",
      "type": "string",
      "description": "RefreshInterval is the amount of time before the values are read again from the SecretStore provider,\nspecified as Golang Duration strings.\nValid time units are \"ns\", \"us\" (or \"\u00b5s\"), \"ms\", \"s\", \"m\", \"h\"\nExample values: \"1h0m0s\", \"2h30m0s\", \"10m0s\"\nMay be set to \"0s\" to fetch and create it once. Defaults to 1h0m0s."
    },
    {
      "field": "spec.refreshPolicy",
      "type": "string",
      "description": "RefreshPolicy determines how the ExternalSecret should be refreshed:\n- CreatedOnce: Creates the Secret only if it does not exist and does not update it thereafter\n- Periodic: Synchronizes the Secret from the external source at regular intervals specified by refreshInterval.\n  No periodic updates occur if refreshInterval is 0.\n- OnChange: Only synchronizes the Secret when the ExternalSecret's metadata or specification changes"
    },
    {
      "field": "spec.target",
      "type": "object",
      "description": "ExternalSecretTarget defines the Kubernetes Secret to be created\nThere can be only one target per ExternalSecret."
    }
  ],
  "status_conditions": [
    "Ready"
  ],
  "execution": {
    "method": "kubectl_apply",
    "wait_condition": "condition=Ready"
  }
}
