{
  "schema_version": "1.0",
  "kind": "PushSecret",
  "group": "external-secrets.io",
  "version": "v1alpha1",
  "plural": "pushsecrets",
  "scope": "namespaced",
  "service": "external-secrets",
  "description": "PushSecret is the Schema for the PushSecrets API that enables pushing Kubernetes secrets to external secret providers.",
  "input_refs": [],
  "output_declarations": [],
  "config_fields": [
    {
      "field": "spec.data",
      "type": "array",
      "description": "Secret Data that should be pushed to providers"
    },
    {
      "field": "spec.deletionPolicy",
      "type": "string",
      "description": "Deletion Policy to handle Secrets in the provider."
    },
    {
      "field": "spec.refreshInterval",
      "type": "string",
      "description": "The Interval to which External Secrets will try to push a secret definition"
    },
    {
      "field": "spec.secretStoreRefs",
      "type": "array"
    },
    {
      "field": "spec.template",
      "type": "object",
      "description": "Template defines a blueprint for the created Secret resource."
    },
    {
      "field": "spec.updatePolicy",
      "type": "string",
      "description": "UpdatePolicy to handle Secrets in the provider."
    }
  ],
  "status_conditions": [
    "Ready"
  ],
  "execution": {
    "method": "kubectl_apply",
    "wait_condition": "condition=Ready"
  }
}
