{
  "schema_version": "1.0",
  "kind": "ServersTransportTCP",
  "group": "traefik.io",
  "version": "v1alpha1",
  "plural": "serverstransporttcps",
  "scope": "namespaced",
  "service": "traefik",
  "description": "ServersTransportTCP is the CRD implementation of a TCPServersTransport.\nIf no tcpServersTransport is specified, a default one named default@internal will be used.\nThe default@internal tcpServersTransport can be configured in the static configuration.\nMore info: https://doc.traefik.io/traefik/v3.6/reference/routing-configuration/tcp/serverstransport/",
  "input_refs": [],
  "output_declarations": [],
  "config_fields": [
    {
      "field": "spec.dialKeepAlive",
      "type": "string",
      "description": "DialKeepAlive is the interval between keep-alive probes for an active network connection. If zero, keep-alive probes are sent with a default value (currently 15 seconds), if supported by the protocol and operating system. Network protocols or operating systems that do not support keep-alives ignore this field. If negative, keep-alive probes are disabled."
    },
    {
      "field": "spec.dialTimeout",
      "type": "string",
      "description": "DialTimeout is the amount of time to wait until a connection to a backend server can be established."
    },
    {
      "field": "spec.proxyProtocol",
      "type": "object",
      "description": "ProxyProtocol holds the PROXY Protocol configuration."
    },
    {
      "field": "spec.terminationDelay",
      "type": "string",
      "description": "TerminationDelay defines the delay to wait before fully terminating the connection, after one connected peer has closed its writing capability."
    },
    {
      "field": "spec.tls",
      "type": "object",
      "description": "TLS defines the TLS configuration"
    }
  ],
  "status_conditions": [
    "Ready"
  ],
  "execution": {
    "method": "kubectl_apply",
    "wait_condition": "condition=Ready"
  }
}
