{
  "schema_version": "1.0",
  "kind": "Certificate",
  "group": "cert-manager.io",
  "version": "v1",
  "plural": "certificates",
  "scope": "namespaced",
  "service": "cert-manager",
  "description": "A Certificate resource should be created to ensure an up to date and signed\nX.509 certificate is stored in the Kubernetes Secret resource named in `spec.secretName`.\n\nThe stored certificate will be renewed before it expires (as configured by `spec.renewBefore`).",
  "input_refs": [
    {
      "field": "spec.issuerRef",
      "target_kind": "Issuer",
      "target_group": "cert-manager.io",
      "role": "input_ref",
      "required": true,
      "cross_namespace": false,
      "fact_ref": "crdfacts://cert-manager.io/Issuer#issuerRef"
    }
  ],
  "output_declarations": [
    {
      "field": "spec.secretName",
      "produces_kind": "Secret",
      "produces_group": "core",
      "role": "output_declaration",
      "fact_ref": "crdfacts://core/Secret#secretName"
    }
  ],
  "config_fields": [
    {
      "field": "spec.additionalOutputFormats",
      "type": "array",
      "description": "Defines extra output formats of the private key and signed certificate chain\nto be written to this Certificate's target Secret."
    },
    {
      "field": "spec.commonName",
      "type": "string",
      "description": "Requested common name X509 certificate subject attribute.\nMore info: https://datatracker.ietf.org/doc/html/rfc5280#section-4.1.2.6\nNOTE: TLS clients will ignore this value when any subject alternative name is\nset (see https://tools.ietf.org/html/rfc6125#section-6.4.4).\n\nShould have a length of 64 characters or fewer to avoid generating invalid CSRs.\nCannot be set if the `literalSubject` field is set."
    },
    {
      "field": "spec.dnsNames",
      "type": "array",
      "description": "Requested DNS subject alternative names."
    },
    {
      "field": "spec.duration",
      "type": "string",
      "description": "Requested 'duration' (i.e. lifetime) of the Certificate. Note that the\nissuer may choose to ignore the requested duration, just like any other\nrequested attribute.\n\nIf unset, this defaults to 90 days.\nMinimum accepted duration is 1 hour.\nValue must be in units accepted by Go time.ParseDuration https://golang.org/pkg/time/#ParseDuration."
    },
    {
      "field": "spec.emailAddresses",
      "type": "array",
      "description": "Requested email subject alternative names."
    },
    {
      "field": "spec.encodeUsagesInRequest",
      "type": "boolean",
      "description": "Whether the KeyUsage and ExtKeyUsage extensions should be set in the encoded CSR.\n\nThis option defaults to true, and should only be disabled if the target\nissuer does not support CSRs with these X509 KeyUsage/ ExtKeyUsage extensions."
    },
    {
      "field": "spec.ipAddresses",
      "type": "array",
      "description": "Requested IP address subject alternative names."
    },
    {
      "field": "spec.isCA",
      "type": "boolean",
      "description": "Requested basic constraints isCA value.\nThe isCA value is used to set the `isCA` field on the created CertificateRequest\nresources. Note that the issuer may choose to ignore the requested isCA value, just\nlike any other requested attribute.\n\nIf true, this will automatically add the `cert sign` usage to the list\nof requested `usages`."
    },
    {
      "field": "spec.keystores",
      "type": "object",
      "description": "Additional keystore output formats to be stored in the Certificate's Secret."
    },
    {
      "field": "spec.literalSubject",
      "type": "string",
      "description": "Requested X.509 certificate subject, represented using the LDAP \"String\nRepresentation of a Distinguished Name\" [1].\nImportant: the LDAP string format also specifies the order of the attributes\nin the subject, this is important when issuing certs for LDAP authentication.\nExample: `CN=foo,DC=corp,DC=example,DC=com`\nMore info [1]: https://datatracker.ietf.org/doc/html/rfc4514\nMore info: https://github.com/cert-manager/cert-manager/issues/3203\nMore info: https://github.com/cert-manager/cert-manager/issues/4424\n\nCannot be set if the `subject` or `commonName` field is set."
    },
    {
      "field": "spec.nameConstraints",
      "type": "object",
      "description": "x.509 certificate NameConstraint extension which MUST NOT be used in a non-CA certificate.\nMore Info: https://datatracker.ietf.org/doc/html/rfc5280#section-4.2.1.10\n\nThis is an Alpha Feature and is only enabled with the\n`--feature-gates=NameConstraints=true` option set on both\nthe controller and webhook components."
    },
    {
      "field": "spec.otherNames",
      "type": "array",
      "description": "`otherNames` is an escape hatch for SAN that allows any type. We currently restrict the support to string like otherNames, cf RFC 5280 p 37\nAny UTF8 String valued otherName can be passed with by setting the keys oid: x.x.x.x and UTF8Value: somevalue for `otherName`.\nMost commonly this would be UPN set with oid: 1.3.6.1.4.1.311.20.2.3\nYou should ensure that any OID passed is valid for the UTF8String type as we do not explicitly validate this."
    },
    {
      "field": "spec.privateKey",
      "type": "object",
      "description": "Private key options. These include the key algorithm and size, the used\nencoding and the rotation policy."
    },
    {
      "field": "spec.renewBefore",
      "type": "string",
      "description": "How long before the currently issued certificate's expiry cert-manager should\nrenew the certificate. For example, if a certificate is valid for 60 minutes,\nand `renewBefore=10m`, cert-manager will begin to attempt to renew the certificate\n50 minutes after it was issued (i.e. when there are 10 minutes remaining until\nthe certificate is no longer valid).\n\nNOTE: The actual lifetime of the issued certificate is used to determine the\nrenewal time. If an issuer returns a certificate with a different lifetime than\nthe one requested, cert-manager will use the lifetime of the issued certificate.\n\nIf unset, this defaults to 1/3 of the issued certificate's lifetime.\nMinimum accepted value is 5 minutes.\nValue must be in units accepted by Go time.ParseDuration https://golang.org/pkg/time/#ParseDuration.\nCannot be set if the `renewBeforePercentage` field is set."
    },
    {
      "field": "spec.renewBeforePercentage",
      "type": "integer",
      "description": "`renewBeforePercentage` is like `renewBefore`, except it is a relative percentage\nrather than an absolute duration. For example, if a certificate is valid for 60\nminutes, and  `renewBeforePercentage=25`, cert-manager will begin to attempt to\nrenew the certificate 45 minutes after it was issued (i.e. when there are 15\nminutes (25%) remaining until the certificate is no longer valid).\n\nNOTE: The actual lifetime of the issued certificate is used to determine the\nrenewal time. If an issuer returns a certificate with a different lifetime than\nthe one requested, cert-manager will use the lifetime of the issued certificate.\n\nValue must be an integer in the range (0,100). The minimum effective\n`renewBefore` derived from the `renewBeforePercentage` and `duration` fields is 5\nminutes.\nCannot be set if the `renewBefore` field is set."
    },
    {
      "field": "spec.revisionHistoryLimit",
      "type": "integer",
      "description": "The maximum number of CertificateRequest revisions that are maintained in\nthe Certificate's history. Each revision represents a single `CertificateRequest`\ncreated by this Certificate, either when it was created, renewed, or Spec\nwas changed. Revisions will be removed by oldest first if the number of\nrevisions exceeds this number.\n\nIf set, revisionHistoryLimit must be a value of `1` or greater.\nDefault value is `1`."
    },
    {
      "field": "spec.secretTemplate",
      "type": "object",
      "description": "Defines annotations and labels to be copied to the Certificate's Secret.\nLabels and annotations on the Secret will be changed as they appear on the\nSecretTemplate when added or removed. SecretTemplate annotations are added\nin conjunction with, and cannot overwrite, the base set of annotations\ncert-manager sets on the Certificate's Secret."
    },
    {
      "field": "spec.signatureAlgorithm",
      "type": "string",
      "description": "Signature algorithm to use.\nAllowed values for RSA keys: SHA256WithRSA, SHA384WithRSA, SHA512WithRSA.\nAllowed values for ECDSA keys: ECDSAWithSHA256, ECDSAWithSHA384, ECDSAWithSHA512.\nAllowed values for Ed25519 keys: PureEd25519."
    },
    {
      "field": "spec.subject",
      "type": "object",
      "description": "Requested set of X509 certificate subject attributes.\nMore info: https://datatracker.ietf.org/doc/html/rfc5280#section-4.1.2.6\n\nThe common name attribute is specified separately in the `commonName` field.\nCannot be set if the `literalSubject` field is set."
    },
    {
      "field": "spec.uris",
      "type": "array",
      "description": "Requested URI subject alternative names."
    },
    {
      "field": "spec.usages",
      "type": "array",
      "description": "Requested key usages and extended key usages.\nThese usages are used to set the `usages` field on the created CertificateRequest\nresources. If `encodeUsagesInRequest` is unset or set to `true`, the usages\nwill additionally be encoded in the `request` field which contains the CSR blob.\n\nIf unset, defaults to `digital signature` and `key encipherment`."
    }
  ],
  "status_conditions": [
    "Ready"
  ],
  "execution": {
    "method": "kubectl_apply",
    "wait_condition": "condition=Ready"
  }
}
