{
  "schema_version": "1.0",
  "kind": "ClusterExternalSecret",
  "group": "external-secrets.io",
  "version": "v1beta1",
  "plural": "clusterexternalsecrets",
  "scope": "cluster",
  "service": "external-secrets",
  "description": "ClusterExternalSecret is the Schema for the clusterexternalsecrets API.",
  "input_refs": [],
  "output_declarations": [
    {
      "field": "spec.externalSecretName",
      "produces_kind": "ExternalSecret",
      "produces_group": "external-secrets.io",
      "role": "output_declaration",
      "fact_ref": "crdfacts://external-secrets.io/ExternalSecret#externalSecretName"
    }
  ],
  "config_fields": [
    {
      "field": "spec.externalSecretMetadata",
      "type": "object",
      "description": "The metadata of the external secrets to be created"
    },
    {
      "field": "spec.externalSecretSpec",
      "type": "object",
      "description": "The spec for the ExternalSecrets to be created"
    },
    {
      "field": "spec.namespaceSelector",
      "type": "object",
      "description": "The labels to select by to find the Namespaces to create the ExternalSecrets in"
    },
    {
      "field": "spec.namespaceSelectors",
      "type": "array",
      "description": "A list of labels to select by to find the Namespaces to create the ExternalSecrets in. The selectors are ORed."
    },
    {
      "field": "spec.namespaces",
      "type": "array",
      "description": "Choose namespaces by name. This field is ORed with anything that NamespaceSelectors ends up choosing.\nDeprecated: Use NamespaceSelectors instead."
    },
    {
      "field": "spec.refreshTime",
      "type": "string",
      "description": "The time in which the controller should reconcile its objects and recheck namespaces for labels."
    }
  ],
  "status_conditions": [
    "Ready"
  ],
  "execution": {
    "method": "kubectl_apply",
    "wait_condition": "condition=Ready"
  }
}
