{
  "schema_version": "1.0",
  "kind": "Order",
  "group": "acme.cert-manager.io",
  "version": "v1",
  "plural": "orders",
  "scope": "namespaced",
  "service": "cert-manager",
  "description": "Order is a type to represent an Order with an ACME server",
  "input_refs": [
    {
      "field": "spec.issuerRef",
      "target_kind": "Issuer",
      "target_group": "acme.cert-manager.io",
      "role": "input_ref",
      "required": true,
      "cross_namespace": false,
      "fact_ref": "crdfacts://acme.cert-manager.io/Issuer#issuerRef"
    }
  ],
  "output_declarations": [],
  "config_fields": [
    {
      "field": "spec.commonName",
      "type": "string",
      "description": "CommonName is the common name as specified on the DER encoded CSR.\nIf specified, this value must also be present in `dnsNames` or `ipAddresses`.\nThis field must match the corresponding field on the DER encoded CSR."
    },
    {
      "field": "spec.dnsNames",
      "type": "array",
      "description": "DNSNames is a list of DNS names that should be included as part of the Order\nvalidation process.\nThis field must match the corresponding field on the DER encoded CSR."
    },
    {
      "field": "spec.duration",
      "type": "string",
      "description": "Duration is the duration for the not after date for the requested certificate.\nthis is set on order creation as pe the ACME spec."
    },
    {
      "field": "spec.ipAddresses",
      "type": "array",
      "description": "IPAddresses is a list of IP addresses that should be included as part of the Order\nvalidation process.\nThis field must match the corresponding field on the DER encoded CSR."
    },
    {
      "field": "spec.profile",
      "type": "string",
      "description": "Profile allows requesting a certificate profile from the ACME server.\nSupported profiles are listed by the server's ACME directory URL."
    },
    {
      "field": "spec.request",
      "type": "string",
      "description": "Certificate signing request bytes in DER encoding.\nThis will be used when finalizing the order.\nThis field must be set on the order."
    }
  ],
  "status_conditions": [
    "Ready"
  ],
  "execution": {
    "method": "kubectl_apply",
    "wait_condition": "condition=Ready"
  }
}
